{"context":{"compact_tokens":8000,"deep_tokens":64000,"default_profile":"DEEP","projection_version":"1.0.0","qualification_ids":{"COMPACT":"sha256:64673f7b54f85d712b5241c2e711bc3732c78546784aa7fd21a4e3690a905900","DEEP":"sha256:013c0e2e366500bbaf0303a30bc5b22aa79d29285e72ab64f0c1cb8bf53bb117","STANDARD":"sha256:54b01e4633fb1b99d06d204fc586c20aee68ad329295a480c5522ad8b54d3550"},"standard_tokens":24000},"decision_source":{"kind":"protected_files","protected_path":"decisions"},"evidence_root":"artifacts/governance/completion/evidence","gates":[{"command":["env","PYTHONPATH=src","python3","scripts/validate_blueprint.py"],"gate_id":"blueprint-quality","max_output_bytes":2000000,"profiles":["code","specification","mixed","governance"],"risk_label":"","shell":false,"timeout_seconds":180},{"command":["env","PYTHONPATH=src","python3","-m","unittest","discover","-s","tests/acceptance","-v"],"gate_id":"acceptance","max_output_bytes":4000000,"profiles":["code","mixed","governance"],"risk_label":"","shell":false,"timeout_seconds":600},{"command":["env","PYTHONPATH=src","python3","-m","unittest","discover","-s","tests/unit","-v"],"gate_id":"unit","max_output_bytes":2000000,"profiles":["code","mixed","governance"],"risk_label":"","shell":false,"timeout_seconds":300},{"command":["env","PYTHONPATH=src","python3","-m","unittest","discover","-s","tests","-v"],"gate_id":"full-suite","max_output_bytes":6000000,"profiles":["code","mixed","governance"],"risk_label":"","shell":false,"timeout_seconds":900},{"command":["env","PYTHONPATH=src","python3","-m","unittest","tests.unit.test_artifact_store","tests.unit.test_gate_runner","tests.unit.test_reviewer_adapter","tests.acceptance.test_attestation","tests.acceptance.test_gate_sandbox","tests.acceptance.test_reviewer_isolation","tests.acceptance.test_reviewer_qualification","tests.acceptance.test_trusted_authority","-v"],"gate_id":"security-adversarial","max_output_bytes":4000000,"profiles":["code","mixed","governance"],"risk_label":"","shell":false,"timeout_seconds":600},{"command":["env","PYTHONPATH=src","python3","-m","unittest","tests.acceptance.test_public_portability","-v"],"gate_id":"public-portability","max_output_bytes":2000000,"profiles":["code","specification","mixed","governance"],"risk_label":"","shell":false,"timeout_seconds":300},{"command":["python3","-m","compileall","-q","src","tests","scripts"],"gate_id":"packaging","max_output_bytes":2000000,"profiles":["code","mixed","governance"],"risk_label":"","shell":false,"timeout_seconds":180},{"command":["/usr/bin/env","python3","-I","-S","-c","import runpy,sys;sys.path.insert(0,'/opt/codex-governance');runpy.run_module('codex_governance.rollback',run_name='__main__',alter_sys=True)","5393338571f8ed5de5192613dcdd6131044932dc"],"gate_id":"rollback-rehearsal","max_output_bytes":2000000,"profiles":["governance"],"risk_label":"","shell":false,"timeout_seconds":300}],"governance_paths":["AGENTS.md",".agents/",".codex/",".github/workflows/","schemas/","scripts/","tests/acceptance/","docs/requirements.md","docs/specification.md","docs/decisions/"],"lkg_governance_commit":"fc3626c210f5fcaa4ca3b9bb08d17636068c2dfa","mutation":{"corpus_path":".governance/releases/v0.1.0/mutation-corpus.json","corpus_sha256":"sha256:f41359f6899fc8e9dc1d126157f9977dd3d003ccd84f5355e0dcc3edb2bb4704","curated_required":true,"generated_budget":0},"policy_id":"POLICY-V0.1.0-PROPOSED","producer_version":"0.1.0","protected_minimums":[{"gate_ids":["blueprint-quality","acceptance","unit","full-suite","security-adversarial","public-portability","packaging"],"path_prefix":"src/","risk_profile":"elevated"},{"gate_ids":["blueprint-quality","acceptance","unit","full-suite","security-adversarial","public-portability","packaging"],"path_prefix":"schemas/","risk_profile":"elevated"}],"repository_id":"repo:timaday/codex-governed-change","reviewer":{"max_output_bytes":4000000,"model":"gpt-5.6-sol","qualification_corpus_sha256":"sha256:49a581f1c941c9b349ad4ae49b4fe04d30a1141795b0eba957842c584fdc68f3","qualification_ids":{"conformance":"sha256:f7d98e5ebbf0c522dc6a847205bdb14361996586fa5db24b9e8924692b512420","rapid_review":"sha256:3246a4938abe2a3ced9fee1b56a2cc668c83ac35d45610cb96c5204f8c0a3603"},"qualification_label_decision_id":"sha256:e950a5cc5d14d852b9e1d4f08af3811a8c72d6b76fe14ca945ff461c457459c4","reasoning_effort":"xhigh","timeout_seconds":1800},"sandbox":{"image":"python@sha256:0c2998a13d94a4afaaaf4613890a9cc9eabc65992d4d24931e3b35fa9c5ab0a5","memory_bytes":2147483648,"network_mode":"none","process_limit":256,"provider":"docker","secrets_present":false},"schema_version":"3.0.0"}