{
  "schema_version": "3.0.0",
  "repository_id": "repo:example/codex-governed-change",
  "policy_id": "POLICY-REFERENCE-001",
  "lkg_governance_commit": "1111111111111111111111111111111111111111",
  "evidence_root": "artifacts/governance",
  "governance_paths": ["AGENTS.md", "IMPLEMENTATION_STATUS.md", "IMPLEMENT_WITH_GPT_5_6.md", "pyproject.toml", ".agents/", ".codex/", ".github/", "src/codex_governance/", "schemas/", "scripts/", "tests/", "docs/requirements.md", "docs/specification.md", "docs/architecture.md", "docs/test-strategy.md", "docs/threat-model.md", "docs/traceability.md", "docs/decisions/"],
  "decision_source": {"kind": "protected_files", "protected_path": "decisions"},
  "protected_minimums": [
    {"path_prefix": "src/", "risk_profile": "standard", "gate_ids": ["blueprint-quality", "acceptance", "unit", "packaging"]},
    {"path_prefix": "schemas/", "risk_profile": "elevated", "gate_ids": ["blueprint-quality", "acceptance", "unit", "security-adversarial", "packaging"]}
  ],
  "sandbox": {
    "provider": "docker",
    "image": "python@sha256:aaaaaaaaaaaaaaaaaaaaaaaaaaaaaaaaaaaaaaaaaaaaaaaaaaaaaaaaaaaaaaaa",
    "network_mode": "none",
    "secrets_present": false,
    "process_limit": 128,
    "memory_bytes": 1073741824
  },
  "context": {
    "default_profile": "STANDARD",
    "compact_tokens": 8000,
    "standard_tokens": 24000,
    "deep_tokens": 64000,
    "projection_version": "1.0.0",
    "qualification_ids": {
      "COMPACT": "sha256:8888888888888888888888888888888888888888888888888888888888888888",
      "STANDARD": "sha256:cd84c537d7d62ee8695c5d4a8a5d7600f2c0e98a2a44d4f9c48bb52b7faaac1a",
      "DEEP": "sha256:aaaaaaaaaaaaaaaaaaaaaaaaaaaaaaaaaaaaaaaaaaaaaaaaaaaaaaaaaaaaaaaa"
    }
  },
  "mutation": {"curated_required": true, "corpus_path": "tests/mutation/corpus.json", "corpus_sha256": "sha256:acef9b470bab854b4807ef8f2a7fc5f60f1650fe630f4ce5d653b592944d52b5", "generated_budget": 0},
  "reviewer": {
    "model": "gpt-5.6-sol",
    "reasoning_effort": "xhigh",
    "timeout_seconds": 1800,
    "max_output_bytes": 1000000,
    "qualification_corpus_sha256": "sha256:6666666666666666666666666666666666666666666666666666666666666666",
    "qualification_label_decision_id": "sha256:7777777777777777777777777777777777777777777777777777777777777777",
    "qualification_ids": {
      "conformance": "sha256:bbbbbbbbbbbbbbbbbbbbbbbbbbbbbbbbbbbbbbbbbbbbbbbbbbbbbbbbbbbbbbbb",
      "rapid_review": "sha256:cccccccccccccccccccccccccccccccccccccccccccccccccccccccccccccccc"
    }
  },
  "gates": [
    {
      "gate_id": "blueprint-quality",
      "profiles": ["code", "specification", "mixed", "governance"],
      "command": ["python3", "scripts/validate_blueprint.py"],
      "timeout_seconds": 120,
      "max_output_bytes": 1000000,
      "shell": false,
      "risk_label": ""
    },
    {
      "gate_id": "acceptance",
      "profiles": ["code", "mixed", "governance"],
      "command": ["env", "PYTHONPATH=src", "python3", "-m", "unittest", "discover", "-s", "tests/acceptance", "-v"],
      "timeout_seconds": 600,
      "max_output_bytes": 2000000,
      "shell": false,
      "risk_label": ""
    },
    {
      "gate_id": "unit",
      "profiles": ["code", "mixed", "governance"],
      "command": ["env", "PYTHONPATH=src", "python3", "-m", "unittest", "discover", "-s", "tests/unit", "-v"],
      "timeout_seconds": 300,
      "max_output_bytes": 2000000,
      "shell": false,
      "risk_label": ""
    },
    {
      "gate_id": "security-adversarial",
      "profiles": ["code", "mixed", "governance"],
      "command": ["env", "PYTHONPATH=src", "python3", "-m", "unittest", "tests.unit.test_artifact_store", "tests.unit.test_gate_runner", "tests.unit.test_reviewer_adapter", "tests.acceptance.test_rapid_review", "-v"],
      "timeout_seconds": 300,
      "max_output_bytes": 2000000,
      "shell": false,
      "risk_label": ""
    },
    {
      "gate_id": "packaging",
      "profiles": ["code", "mixed", "governance"],
      "command": ["python3", "-m", "compileall", "-q", "src", "tests", "scripts"],
      "timeout_seconds": 120,
      "max_output_bytes": 1000000,
      "shell": false,
      "risk_label": ""
    },
    {
      "gate_id": "rollback-rehearsal",
      "profiles": ["governance"],
      "command": ["/usr/bin/env", "python3", "-I", "-S", "-c", "import runpy,sys;sys.path.insert(0,'/opt/codex-governance');runpy.run_module('codex_governance.rollback',run_name='__main__',alter_sys=True)", "1111111111111111111111111111111111111111"],
      "timeout_seconds": 300,
      "max_output_bytes": 1000000,
      "shell": false,
      "risk_label": ""
    }
  ],
  "producer_version": "0.1.0-example"
}
