{"context":{"compact_tokens":8000,"deep_tokens":64000,"default_profile":"DEEP","projection_version":"1.0.0","qualification_ids":{"COMPACT":"sha256:973185f570c7389fde55611f3dafca801bfea6354a2d23673beebdb69f2f03b8","DEEP":"sha256:07db5493b0dbf9ada4c7627cfa6d9b02410d7a8c28dca11cc89d3e2de52a966f","STANDARD":"sha256:f021b8733ea9dd354720390285a823f153474ba1d538d28fb8e16d614efc49a6"},"standard_tokens":24000},"decision_source":{"kind":"protected_files","protected_path":"decisions"},"evidence_root":"artifacts/governance/completion/evidence","gates":[{"command":["env","PYTHONPATH=src","python3","scripts/validate_blueprint.py"],"gate_id":"blueprint-quality","max_output_bytes":2000000,"profiles":["code","specification","mixed","governance"],"risk_label":"","shell":false,"timeout_seconds":180},{"command":["env","PYTHONPATH=src","python3","-m","unittest","discover","-s","tests/acceptance","-v"],"gate_id":"acceptance","max_output_bytes":4000000,"profiles":["code","mixed","governance"],"risk_label":"","shell":false,"timeout_seconds":900},{"command":["env","PYTHONPATH=src","python3","-m","unittest","discover","-s","tests/unit","-v"],"gate_id":"unit","max_output_bytes":2000000,"profiles":["code","mixed","governance"],"risk_label":"","shell":false,"timeout_seconds":300},{"command":["env","PYTHONPATH=src","python3","-m","unittest","discover","-s","tests","-v"],"gate_id":"full-suite","max_output_bytes":6000000,"profiles":["code","mixed","governance"],"risk_label":"","shell":false,"timeout_seconds":900},{"command":["env","PYTHONPATH=src","python3","-m","unittest","tests.unit.test_artifact_store","tests.unit.test_gate_runner","tests.unit.test_reviewer_adapter","tests.acceptance.test_attestation","tests.acceptance.test_gate_sandbox","tests.acceptance.test_reviewer_isolation","tests.acceptance.test_reviewer_qualification","tests.acceptance.test_trusted_authority","-v"],"gate_id":"security-adversarial","max_output_bytes":4000000,"profiles":["code","mixed","governance"],"risk_label":"","shell":false,"timeout_seconds":600},{"command":["env","PYTHONPATH=src","python3","-m","unittest","tests.acceptance.test_public_portability","-v"],"gate_id":"public-portability","max_output_bytes":2000000,"profiles":["code","specification","mixed","governance"],"risk_label":"","shell":false,"timeout_seconds":300},{"command":["python3","-m","compileall","-q","src","tests","scripts"],"gate_id":"packaging","max_output_bytes":2000000,"profiles":["code","mixed","governance"],"risk_label":"","shell":false,"timeout_seconds":180},{"command":["python3","-I","-S","-c","import subprocess,sys;t=sys.argv[1];r=subprocess.run([sys.executable,'-X','pycache_prefix=/tmp/rollback-pycache','-I','-S','scripts/validate_blueprint.py'],stdin=subprocess.DEVNULL,stdout=subprocess.PIPE,stderr=subprocess.PIPE);ok=r.returncode==0 and r.stderr==b'';sys.stdout.write('ROLLBACK_REHEARSAL=PASS target='+t+'\\n') if ok else sys.stderr.write('rollback oracle failed\\n');raise SystemExit(0 if ok else 1)","a0a0b01a19e87f2591c7e97e892cd040ce9c6e58"],"gate_id":"initial-lkg-rollback-quality","max_output_bytes":2000000,"profiles":["code"],"risk_label":"","shell":false,"timeout_seconds":180},{"command":["/usr/bin/env","python3","-I","-S","-c","import runpy,sys;sys.path.insert(0,'/opt/codex-governance');runpy.run_module('codex_governance.rollback',run_name='__main__',alter_sys=True)","5393338571f8ed5de5192613dcdd6131044932dc"],"gate_id":"rollback-rehearsal","max_output_bytes":2000000,"profiles":["governance"],"risk_label":"","shell":false,"timeout_seconds":300}],"governance_paths":["AGENTS.md",".agents/",".codex/",".github/workflows/","schemas/","scripts/","tests/acceptance/","docs/requirements.md","docs/specification.md","docs/decisions/"],"lkg_governance_commit":"5393338571f8ed5de5192613dcdd6131044932dc","mutation":{"corpus_path":".governance/releases/v0.1.0/mutation-corpus.json","corpus_sha256":"sha256:ffb541f5d2d8bba279a665313e464818de1cfdcb69b3576a141f1559b64938af","curated_required":true,"generated_budget":0},"policy_id":"POLICY-T24-LOCAL-PROOF-001","producer_version":"0.1.0","protected_minimums":[{"gate_ids":["blueprint-quality","acceptance","unit","full-suite","security-adversarial","public-portability","packaging"],"path_prefix":"src/","risk_profile":"elevated"},{"gate_ids":["blueprint-quality","acceptance","unit","full-suite","security-adversarial","public-portability","packaging"],"path_prefix":"schemas/","risk_profile":"elevated"}],"repository_id":"repo:timaday/codex-governed-change","reviewer":{"max_output_bytes":4000000,"model":"gpt-5.6-sol","qualification_corpus_sha256":"sha256:49a581f1c941c9b349ad4ae49b4fe04d30a1141795b0eba957842c584fdc68f3","qualification_ids":{"conformance":"sha256:7b5a576b98bc657238b61c8880b5e10f54945d83d48d88987de6d42b039818dd","rapid_review":"sha256:c01a10c10408086a5a3a15ea14f1b401b56bca32c3b28f0ac778f2f2a6702569"},"qualification_label_decision_id":"sha256:e950a5cc5d14d852b9e1d4f08af3811a8c72d6b76fe14ca945ff461c457459c4","reasoning_effort":"xhigh","timeout_seconds":1800},"sandbox":{"image":"python@sha256:0c2998a13d94a4afaaaf4613890a9cc9eabc65992d4d24931e3b35fa9c5ab0a5","memory_bytes":2147483648,"network_mode":"none","process_limit":256,"provider":"docker","secrets_present":false},"schema_version":"3.0.0"}